{
  "runner_name": "speckit_pro_runner",
  "runner_contract_id": "speckit-pro-runner",
  "selected_runtime_name": "python-stdlib-runner",
  "contract_version": "1.0",
  "plugin_version": "2.27.0",
  "runner_version": "0.1.0",
  "source_revision": "unknown",
  "python_minimum_version": "3.11",
  "specify_required": true,
  "checksum_algorithm": "sha256",
  "runner_files": [
    {
      "path": {
        "kind": "plugin_relative",
        "value": "speckit_pro_runner/__init__.py",
        "display": "speckit_pro_runner/__init__.py"
      },
      "sha256": "da73c7c2e5fbf485936f5afab668fe74779c1581f82293bedad6ce746b3c8b46"
    },
    {
      "path": {
        "kind": "plugin_relative",
        "value": "speckit_pro_runner/__main__.py",
        "display": "speckit_pro_runner/__main__.py"
      },
      "sha256": "1e991a688778613a8c234821dc6ccda88a99c4e885e5bbc001eacd34df0b9b2b"
    },
    {
      "path": {
        "kind": "plugin_relative",
        "value": "speckit_pro_runner/agent_materialization.py",
        "display": "speckit_pro_runner/agent_materialization.py"
      },
      "sha256": "257338f3cb22e2dc392f0ab9ccf0107b53cc09e05b4a3be00954d1a8a8de095d"
    },
    {
      "path": {
        "kind": "plugin_relative",
        "value": "speckit_pro_runner/envelope.py",
        "display": "speckit_pro_runner/envelope.py"
      },
      "sha256": "1bb3435083ff47e9c0610e24f0814c2db8a8e4b3d49b13aed1a48dd87a57526f"
    },
    {
      "path": {
        "kind": "plugin_relative",
        "value": "speckit_pro_runner/gates/__init__.py",
        "display": "speckit_pro_runner/gates/__init__.py"
      },
      "sha256": "5b4373aaf0afd0803e0885aa047974672cea3ff40e38a853fa1487735384909c"
    },
    {
      "path": {
        "kind": "plugin_relative",
        "value": "speckit_pro_runner/gates/active_path_guard.py",
        "display": "speckit_pro_runner/gates/active_path_guard.py"
      },
      "sha256": "a092a150d1877f30ddf95ae2786591649ee678cbf9a030564cdc7103401a00b2"
    },
    {
      "path": {
        "kind": "plugin_relative",
        "value": "speckit_pro_runner/gates/gate_response.py",
        "display": "speckit_pro_runner/gates/gate_response.py"
      },
      "sha256": "9544640a2eca56e9e236efe6e0230c5346c0d466cb25545ad7affc519769026a"
    },
    {
      "path": {
        "kind": "plugin_relative",
        "value": "speckit_pro_runner/gates/payloads.py",
        "display": "speckit_pro_runner/gates/payloads.py"
      },
      "sha256": "5cbef2ebd78b524baf7dc1f69b8b35db42a77452a87de8111186c634fd488a02"
    },
    {
      "path": {
        "kind": "plugin_relative",
        "value": "speckit_pro_runner/gates/registry.py",
        "display": "speckit_pro_runner/gates/registry.py"
      },
      "sha256": "57fd93af9ea63d36786a9ae0a43a7464d131a4ae09d2b033df6536b36a68ba92"
    },
    {
      "path": {
        "kind": "plugin_relative",
        "value": "speckit_pro_runner/gates/release.py",
        "display": "speckit_pro_runner/gates/release.py"
      },
      "sha256": "e87d890856aa6c9e7b1f4b70e9195826dcdf743890fa6df44a56939441bf6a65"
    },
    {
      "path": {
        "kind": "plugin_relative",
        "value": "speckit_pro_runner/gates/suite.py",
        "display": "speckit_pro_runner/gates/suite.py"
      },
      "sha256": "728be6b720e9be81bb90658d96712892a57bf8ebcb02f31a44308e8af771a33f"
    },
    {
      "path": {
        "kind": "plugin_relative",
        "value": "speckit_pro_runner/helpers/__init__.py",
        "display": "speckit_pro_runner/helpers/__init__.py"
      },
      "sha256": "00fe68ad0f274c880dfd550325423d301d61e8c9eb066611080f9e378191a4f1"
    },
    {
      "path": {
        "kind": "plugin_relative",
        "value": "speckit_pro_runner/helpers/install.py",
        "display": "speckit_pro_runner/helpers/install.py"
      },
      "sha256": "ca7ae3af792cab4e9baace840a89b7a7796cdf1f58c0e8431d514b5f4ed2dd67"
    },
    {
      "path": {
        "kind": "plugin_relative",
        "value": "speckit_pro_runner/helpers/mutation.py",
        "display": "speckit_pro_runner/helpers/mutation.py"
      },
      "sha256": "7b2e939bb663f985ece886bcd7ab8310080bd20b13621d98c57f0cdd03ff9e58"
    },
    {
      "path": {
        "kind": "plugin_relative",
        "value": "speckit_pro_runner/helpers/pr_emission.py",
        "display": "speckit_pro_runner/helpers/pr_emission.py"
      },
      "sha256": "13db6db83c8cedb94ec398ea525ef3db5f5ea139c592535b53bd66f796bb5c87"
    },
    {
      "path": {
        "kind": "plugin_relative",
        "value": "speckit_pro_runner/helpers/promotion.py",
        "display": "speckit_pro_runner/helpers/promotion.py"
      },
      "sha256": "124f2aa4595247c27976f2894b5f36a4c79405641ca53eea6fb9412013776819"
    },
    {
      "path": {
        "kind": "plugin_relative",
        "value": "speckit_pro_runner/helpers/read_only.py",
        "display": "speckit_pro_runner/helpers/read_only.py"
      },
      "sha256": "07c4ab041767ddbf7c914d5edc3633a8fda98491c36e001c26aab1c6d95ee2d7"
    },
    {
      "path": {
        "kind": "plugin_relative",
        "value": "speckit_pro_runner/helpers/registry.py",
        "display": "speckit_pro_runner/helpers/registry.py"
      },
      "sha256": "f4c42046bc8a040d53cfc05486d5d5a3c2952d933b200f0c10b675c061b8e147"
    },
    {
      "path": {
        "kind": "plugin_relative",
        "value": "speckit_pro_runner/materializer.py",
        "display": "speckit_pro_runner/materializer.py"
      },
      "sha256": "d07d7eb158c1ec7cb801d76d80cda62a904f405caa5e9e7ed549731dbb3b66f0"
    },
    {
      "path": {
        "kind": "plugin_relative",
        "value": "speckit_pro_runner/merge_utils.py",
        "display": "speckit_pro_runner/merge_utils.py"
      },
      "sha256": "a4a0a7ba1ac82c30e4f2bf54181b661a738ae524cfc98c490210dce15300c6ed"
    },
    {
      "path": {
        "kind": "plugin_relative",
        "value": "speckit_pro_runner/path_utils.py",
        "display": "speckit_pro_runner/path_utils.py"
      },
      "sha256": "02840b01a30d3d891b219df26cf2efcd66325d196e6959317acee7353afddb29"
    },
    {
      "path": {
        "kind": "plugin_relative",
        "value": "speckit_pro_runner/runtime.py",
        "display": "speckit_pro_runner/runtime.py"
      },
      "sha256": "3cb545c1b202376945f820e039db5e30f80ef411786089901230caf406f1dc91"
    }
  ]
}
